{
  "$schema": "https://json-schema.org/draft/2020-12/schema",
  "$id": "result.schema.json",
  "type": "object",
  "additionalProperties": false,
  "required": ["inputId", "skillId", "status", "scores", "total", "artifacts", "evidence", "deviations", "runtime"],
  "properties": {
    "inputId": { "type": "string", "pattern": "^(?=.*[a-z0-9])[a-z0-9]+(?:-[a-z0-9]+)*$" },
    "skillId": { "type": "string", "pattern": "^(?=.*[a-z0-9])[a-z0-9]+(?:-[a-z0-9]+)*$" },
    "status": { "enum": ["PENDING", "RUNNING", "PASS", "PASS_WITH_CONCERNS", "BLOCKED", "NOT_APPLICABLE"] },
    "scores": { "oneOf": [{ "$ref": "#/$defs/scores" }, { "type": "null" }] },
    "total": { "type": ["number", "null"], "minimum": 0, "maximum": 100 },
    "artifacts": { "type": "array", "items": { "type": "string", "pattern": "\\S" } },
    "evidence": { "type": "array", "items": { "type": "string", "pattern": "\\S" } },
    "deviations": { "type": "array", "items": { "type": "string", "pattern": "\\S" } },
    "reason": { "type": "string", "pattern": "^(?=.{10,})(?=.*\\S).*$" },
    "runtime": {
      "type": "object",
      "additionalProperties": false,
      "required": ["startedAt", "finishedAt", "durationMs"],
      "properties": {
        "startedAt": { "type": "string", "pattern": "^\\d{4}-\\d{2}-\\d{2}T\\d{2}:\\d{2}:\\d{2}(?:\\.\\d{3})?Z$" },
        "finishedAt": { "type": "string", "pattern": "^\\d{4}-\\d{2}-\\d{2}T\\d{2}:\\d{2}:\\d{2}(?:\\.\\d{3})?Z$" },
        "durationMs": { "type": "number", "minimum": 0 }
      }
    }
  },
  "$defs": {
    "scores": {
      "type": "object",
      "additionalProperties": false,
      "required": ["fidelity", "flowCoverage", "interaction", "visualHierarchy", "edgeStates", "stability", "handoff"],
      "properties": {
        "fidelity": { "type": "number", "minimum": 0, "maximum": 20 },
        "flowCoverage": { "type": "number", "minimum": 0, "maximum": 15 },
        "interaction": { "type": "number", "minimum": 0, "maximum": 20 },
        "visualHierarchy": { "type": "number", "minimum": 0, "maximum": 15 },
        "edgeStates": { "type": "number", "minimum": 0, "maximum": 10 },
        "stability": { "type": "number", "minimum": 0, "maximum": 10 },
        "handoff": { "type": "number", "minimum": 0, "maximum": 10 }
      }
    }
  },
  "allOf": [{
    "if": { "properties": { "status": { "enum": ["BLOCKED", "NOT_APPLICABLE"] } }, "required": ["status"] },
    "then": { "required": ["reason"], "properties": { "scores": { "type": "null" }, "total": { "type": "null" }, "deviations": { "minItems": 1 } } },
    "else": { "not": { "required": ["reason"] }, "properties": { "scores": { "$ref": "#/$defs/scores" }, "total": { "type": "number" } } }
  }]
}
