{
  "inputId": "outfit-tab",
  "skillId": "inspire-prototype",
  "status": "PASS_WITH_CONCERNS",
  "scores": {
    "fidelity": 8,
    "flowCoverage": 7,
    "interaction": 5,
    "visualHierarchy": 7,
    "edgeStates": 1,
    "stability": 9,
    "handoff": 7
  },
  "total": 44,
  "artifacts": [
    "https://6a54c06f0355ab02671022c5-prototype.inspire.bytedance.net"
  ],
  "evidence": [
    "run/native.ndjson",
    "run/generation-invocation.json",
    "run/prompt.txt",
    "run/raw/whoami.json",
    "run/raw/skills-visible.json",
    "qa/browser-qa.md",
    "qa/replay-browser-qa.mjs",
    "qa/01-entry.png",
    "qa/02-category-scene.png",
    "qa/03-detail-guidance.png",
    "qa/04-product-ai-actions.png"
  ],
  "deviations": [
    "The original full generation stdout was not persisted byte-for-byte; native.ndjson is explicitly a normalized audit log reconstructed from the agent tool-call record and original started/done output, while only the recalibrated read-only CLI outputs are raw.",
    "The platform maximum is 10 images, so the rejected 13-image attempt was recovered with the frozen PRD body unchanged and only this cell's five product-solution images attached.",
    "Live browser testing found dead purchase, AI styling, and AI try-on controls despite platform compile success and 5/5 generated captures.",
    "Generated feed/detail imagery is unrelated to clothing, and avoidance, size, and fabric guidance are absent."
  ],
  "runtime": {
    "startedAt": "2026-07-13T10:39:38.000Z",
    "finishedAt": "2026-07-13T10:47:20.300Z",
    "durationMs": 462300
  }
}
