{
  "inputId": "camera-upload",
  "skillId": "vne-prototype",
  "status": "PASS_WITH_CONCERNS",
  "scores": {
    "fidelity": 14,
    "flowCoverage": 15,
    "interaction": 18,
    "visualHierarchy": 10,
    "edgeStates": 6,
    "stability": 9,
    "handoff": 6
  },
  "total": 78,
  "artifacts": [
    "camera-upload-ui-spec.md",
    "prototype.manifest.json",
    "artifact/camera-upload/prototype.manifest.json",
    "artifact/camera-upload/src/App.tsx",
    "artifact/camera-upload/src/pages/HomePage.tsx",
    "artifact/camera-upload/src/pages/camera-upload.css",
    "artifact/camera-upload/dist/index.html",
    "README.md"
  ],
  "evidence": [
    "run/native-run.md",
    "qa/quality-report.md",
    "artifact/camera-upload/qa/browser-qa.spec.cjs",
    "artifact/camera-upload/qa/browser-qa-raw.json",
    "artifact/camera-upload/qa/browser-qa.stdout.txt",
    "artifact/camera-upload/qa/browser-qa.exit-code.txt",
    "artifact/camera-upload/qa/01-entry.png",
    "artifact/camera-upload/qa/02-upload-choices.png",
    "artifact/camera-upload/qa/03-camera.png",
    "artifact/camera-upload/qa/04-album.png",
    "artifact/camera-upload/qa/05-confirm.png",
    "artifact/camera-upload/qa/06-reviewing.png",
    "artifact/camera-upload/qa/07-review-failure.png"
  ],
  "deviations": [
    "Camera capture and remote review are deterministic local simulations; no device permission request or review service is invoked.",
    "The required VNE standard console shell frames a mobile interaction preview rather than reproducing the source application as a full-screen mobile product.",
    "Supplied full-screen camera captures are used as preview media beneath generated camera controls, so some source chrome remains visible.",
    "The official scaffold omitted the internal-registry .npmrc described by VNE build guidance; initialization required adding it and explicitly approving the six build-script dependencies reported by pnpm 11.",
    "Browser QA validates the ten contracted failure-path tasks in a 1280×900 desktop viewport, not a mobile viewport; a review-success branch and a second viewport are not asserted.",
    "The desktop VNE console shell and embedded mobile camera flow form two simultaneous UI systems; source screenshots are object-fit cropped under generated controls, leaving black/cropped regions and duplicated source chrome.",
    "Review success, actual device-unavailable behavior, and review-service/network error states are absent; the permission and album-empty treatments do not represent complete executable branches.",
    "The UI specification describes five pages and complete empty/error coverage, while the implementation is one stateful page and does not fully implement those specified states.",
    "The build output is not strictly one file: dist/index.html references dist/assets/camera.png and dist/assets/captured.png, which must be shipped together.",
    "The QA harness hard-codes a macOS Chrome executable path, installation requires the internal registry and explicit pnpm build approvals, and no clean-checkout reinstall/rebuild was performed.",
    "VNE telemetry commands were invoked during the session, but their raw responses, timestamps, and exit records were not persisted; they are not independently auditable and are treated as an unverified native-flow deviation."
  ],
  "runtime": {
    "startedAt": "2026-07-13T12:34:45.045Z",
    "finishedAt": "2026-07-13T13:00:59.951Z",
    "durationMs": 1574906
  }
}
