{
  "inputId": "outfit-tab",
  "skillId": "prd-generator",
  "status": "PASS_WITH_CONCERNS",
  "scores": {
    "fidelity": 18,
    "flowCoverage": 15,
    "interaction": 19,
    "visualHierarchy": 14,
    "edgeStates": 10,
    "stability": 9,
    "handoff": 10
  },
  "total": 95,
  "artifacts": [
    "artifact/index.html",
    "artifact/prd.md",
    "artifact/pages/01-outfit.html",
    "artifact/docs/prd/outfit-tab/prd.yaml",
    "artifact/docs/prd/outfit-tab/prd.md",
    "artifact/docs/prd/outfit-tab/prd-v0.md",
    "artifact/docs/prd/outfit-tab/canvas/pages/01-outfit.html",
    "run/decisions.md"
  ],
  "evidence": [
    "qa/journey-log.json records a single-entry consecutive Chrome CDP journey with all tasks passing and empty consoleErrors/pageErrors.",
    "qa/browser-qa.md records all five fixed task results and real-browser screenshots.",
    "qa/audit.md records zero prototype hard failures.",
    "qa/screenshots/category.png proves category selection and feed change.",
    "qa/screenshots/detail.png proves the reason card, suitability, formula and avoidance guidance.",
    "qa/screenshots/product.png proves lower-cost alternative product information.",
    "qa/screenshots/ai.png proves the AI try-on destination state."
  ],
  "deviations": [
    "Playwright was unavailable in the worktree; a reproducible Google Chrome CDP script performed the consecutive click journey instead.",
    "Independent reviewer agents were not authorized for this worker; text and design reviews are explicitly labeled main-agent self-review."
  ],
  "runtime": {
    "startedAt": "2026-07-13T09:57:00.000Z",
    "finishedAt": "2026-07-13T10:18:00.000Z",
    "durationMs": 1260000
  }
}
