{
  "inputId": "camera-upload",
  "skillId": "inspire-prototype",
  "status": "PASS_WITH_CONCERNS",
  "scores": {
    "fidelity": 13,
    "flowCoverage": 13,
    "interaction": 15,
    "visualHierarchy": 12,
    "edgeStates": 6,
    "stability": 9,
    "handoff": 6
  },
  "total": 74,
  "artifacts": [
    "artifact/remote-asset.json",
    "https://6a54dba21afe4f0267392504-prototype.inspire.bytedance.net"
  ],
  "evidence": [
    "run/generation.sanitized.json",
    "run/asset-report.sanitized.json",
    "run/native-evidence-availability.md",
    "run/commands.md",
    "qa/raw/browser-qa.json",
    "qa/raw/chrome-runtime-summary.json",
    "qa/assessment.md",
    "qa/screenshots/01-source-sheet.png",
    "qa/screenshots/03-camera-front.png",
    "qa/screenshots/06-confirm.png",
    "qa/screenshots/08-moderating.png",
    "qa/screenshots/09-review-failed.png",
    "qa/screenshots/branch-success.png",
    "qa/screenshots/branch-error.png"
  ],
  "deviations": [
    "Both re-upload controls are non-functional: neither failed-review nor service-error recovery restarts upload or capture.",
    "Failure guidance is generic and lacks the requested concrete compliance instructions.",
    "Food, landscape and generic-person placeholder photography conflicts with the clear single-person frontal-face objective and does not clearly reuse supplied fixture imagery.",
    "The original generation NDJSON was not persisted; the saved native report is a field-level sanitized asset query, while generation metadata is a compact derived record with reduced event-level auditability.",
    "Camera and moderation are explicitly simulated and do not call device or review services, as required for the demo."
  ],
  "runtime": {
    "startedAt": "2026-07-13T12:35:46.367Z",
    "finishedAt": "2026-07-13T12:39:23.894Z",
    "durationMs": 217527
  }
}
