{
  "inputId": "outfit-tab",
  "skillId": "vne-prototype",
  "status": "BLOCKED",
  "scores": null,
  "total": null,
  "artifacts": [
    "artifact/outfit-tab-ui-spec.md",
    "artifact/outfit-tab-prototype/prototype.manifest.json",
    "artifact/outfit-tab-prototype/src/pages/HomePage.tsx"
  ],
  "evidence": [
    "run/native-run.md",
    "qa/fixed-tasks.md",
    "qa/quality-report.md"
  ],
  "deviations": [
    "The official private cloud-materials dependency could not be installed: public npm returned 404; a later request for approval to launch the official bnpm build was rejected by the approval gate before process launch, so no subprocess exit code, stdout, or stderr exists.",
    "Because the native build gate did not pass, no dist/index.html, dev preview, browser task execution, console/pageerror capture, or screenshots were produced."
  ],
  "reason": "Native VNE build remains blocked until the user explicitly authorizes the official bnpm registry credential flow and the exact build and manual browser QA recovery steps in run/native-run.md complete successfully.",
  "runtime": {
    "startedAt": "2026-07-13T09:00:00.000Z",
    "finishedAt": "2026-07-13T09:12:00.000Z",
    "durationMs": 720000
  }
}
