{
  "inputId": "camera-upload",
  "skillId": "prd-generator",
  "status": "PASS_WITH_CONCERNS",
  "scores": {
    "fidelity": 15,
    "flowCoverage": 15,
    "interaction": 17,
    "visualHierarchy": 10,
    "edgeStates": 8,
    "stability": 9,
    "handoff": 7
  },
  "total": 81,
  "artifacts": [
    "artifact/index.html",
    "artifact/assets/create.png",
    "artifact/assets/camera.png",
    "artifact/assets/captured.png",
    "artifact/assets/review-failed.png",
    "README.md",
    "docs/prd/camera-upload/prd.yaml",
    "docs/prd/camera-upload/prd.md",
    "docs/prd/camera-upload/prd-v0.md",
    "docs/prd/camera-upload/canvas/pages/01-camera-upload.html",
    "docs/prd/camera-upload/canvas/tokens.css",
    "docs/prd/camera-upload/canvas/patterns.md"
  ],
  "evidence": [
    "qa/browser-qa.spec.js",
    "qa/run-browser-qa.sh",
    "qa/browser-qa-raw.json",
    "qa/browser-qa-execution.json",
    "qa/browser-qa-stdout.log",
    "qa/01-entry.png",
    "qa/02-upload-choices.png",
    "qa/03-camera.png",
    "qa/04-album.png",
    "qa/05-confirm.png",
    "qa/06-loading.png",
    "qa/07-review-failure.png",
    "qa/08-service-timeout.png",
    "run/evidence/prototype-audit.txt",
    "docs/prd/camera-upload/reviews/stage-2-review.md",
    "docs/prd/camera-upload/reviews/stage-3-review.md"
  ],
  "deviations": [
    "Camera capture and remote review are deterministic simulations using the supplied local fixture assets.",
    "Reviewer records are reproducible but were not produced by an independent clean-context reviewer.",
    "Browser QA defaults to the system Chrome executable on macOS; other environments must set QA_BROWSER_EXECUTABLE.",
    "Supplied full-screen screenshots are reused as media inside the prototype shell, producing duplicated status bars, close/flip/shutter controls, and mirrored text in camera-related views.",
    "Menu and search are scope markers implemented as toast acknowledgements; album choices converge on one confirmation path.",
    "A successful review, camera-permission denial, and empty-album state are not represented.",
    "The exported canvas tokens document the inferred design system but the standalone canvas page does not consume tokens.css at runtime."
  ],
  "runtime": {
    "startedAt": "2026-07-13T11:51:16.300Z",
    "finishedAt": "2026-07-13T12:23:44.605Z",
    "durationMs": 1948305
  }
}
